[
  {
    "id": "steam-bg3",
    "title": "Baldur's Gate 3",
    "platform": "steam",
    "coverUrl": "https://shared.akamai.steamstatic.com/store_item_assets/steam/apps/1086940/library_600x900.jpg",
    "lastPlayed": "2026-09-12T21:14:00.000Z",
    "steamAppId": "1086940"
  },
  {
    "id": "steam-elden-ring",
    "title": "Elden Ring",
    "platform": "steam",
    "coverUrl": "https://shared.akamai.steamstatic.com/store_item_assets/steam/apps/1245620/library_600x900.jpg",
    "lastPlayed": "2026-09-10T18:02:00.000Z",
    "steamAppId": "1245620"
  },
  {
    "id": "steam-cyberpunk",
    "title": "Cyberpunk 2077",
    "platform": "steam",
    "coverUrl": "https://shared.akamai.steamstatic.com/store_item_assets/steam/apps/1091500/library_600x900.jpg",
    "lastPlayed": "2026-08-28T23:41:00.000Z",
    "steamAppId": "1091500"
  },
  {
    "id": "steam-cs2",
    "title": "Counter-Strike 2",
    "platform": "steam",
    "coverUrl": "https://shared.akamai.steamstatic.com/store_item_assets/steam/apps/730/library_600x900.jpg",
    "lastPlayed": "2026-09-13T16:05:00.000Z",
    "steamAppId": "730"
  },
  {
    "id": "steam-hades",
    "title": "Hades",
    "platform": "steam",
    "coverUrl": "https://shared.akamai.steamstatic.com/store_item_assets/steam/apps/1145360/library_600x900.jpg",
    "lastPlayed": null,
    "steamAppId": "1145360"
  },
  {
    "id": "steam-rdr2",
    "title": "Red Dead Redemption 2",
    "platform": "steam",
    "coverUrl": "https://shared.akamai.steamstatic.com/store_item_assets/steam/apps/1174180/library_600x900.jpg",
    "lastPlayed": "2026-07-19T20:11:00.000Z",
    "steamAppId": "1174180"
  },
  {
    "id": "epic-fortnite",
    "title": "Fortnite",
    "platform": "epic",
    "coverUrl": "https://cdn2.unrealengine.com/social-image-chapter5-s1-3840x2160-0c81e627e022.jpg",
    "lastPlayed": "2026-09-11T19:30:00.000Z",
    "epicAppName": "Fortnite"
  },
  {
    "id": "epic-rocket-league",
    "title": "Rocket League",
    "platform": "epic",
    "coverUrl": "https://shared.akamai.steamstatic.com/store_item_assets/steam/apps/252950/library_600x900.jpg",
    "lastPlayed": "2026-09-01T14:22:00.000Z",
    "epicAppName": "Sugar"
  },
  {
    "id": "epic-alan-wake-2",
    "title": "Alan Wake 2",
    "platform": "epic",
    "coverUrl": "https://shared.akamai.steamstatic.com/store_item_assets/steam/apps/239350/library_600x900.jpg",
    "lastPlayed": null,
    "epicAppName": "AlanWake2"
  },
  {
    "id": "epic-fall-guys",
    "title": "Fall Guys",
    "platform": "epic",
    "coverUrl": "https://shared.akamai.steamstatic.com/store_item_assets/steam/apps/1097150/library_600x900.jpg",
    "lastPlayed": "2026-06-02T11:08:00.000Z",
    "epicAppName": "FallGuys"
  },
  {
    "id": "epic-control",
    "title": "Control Ultimate Edition",
    "platform": "epic",
    "coverUrl": "https://shared.akamai.steamstatic.com/store_item_assets/steam/apps/870780/library_600x900.jpg",
    "lastPlayed": "2026-05-14T22:00:00.000Z",
    "epicAppName": "Control"
  },
  {
    "id": "ps5-gow-ragnarok",
    "title": "God of War Ragnarök",
    "platform": "ps5",
    "coverUrl": "https://shared.akamai.steamstatic.com/store_item_assets/steam/apps/2322010/library_600x900.jpg",
    "lastPlayed": "2026-09-08T21:47:00.000Z"
  },
  {
    "id": "ps5-spider-man-2",
    "title": "Marvel's Spider-Man 2",
    "platform": "ps5",
    "coverUrl": "https://shared.akamai.steamstatic.com/store_item_assets/steam/apps/1817070/library_600x900.jpg",
    "lastPlayed": "2026-08-30T17:19:00.000Z"
  },
  {
    "id": "ps5-horizon",
    "title": "Horizon Forbidden West",
    "platform": "ps5",
    "coverUrl": "https://shared.akamai.steamstatic.com/store_item_assets/steam/apps/2420110/library_600x900.jpg",
    "lastPlayed": null
  },
  {
    "id": "ps5-tlou",
    "title": "The Last of Us Part I",
    "platform": "ps5",
    "coverUrl": "https://shared.akamai.steamstatic.com/store_item_assets/steam/apps/1888930/library_600x900.jpg",
    "lastPlayed": "2026-04-21T19:03:00.000Z"
  },
  {
    "id": "ps5-ghost",
    "title": "Ghost of Tsushima",
    "platform": "ps5",
    "coverUrl": "https://shared.akamai.steamstatic.com/store_item_assets/steam/apps/2215430/library_600x900.jpg",
    "lastPlayed": "2026-09-03T20:55:00.000Z"
  },
  {
    "id": "steam-no-id",
    "title": "Steam (Library Fallback)",
    "platform": "steam",
    "coverUrl": "https://shared.akamai.steamstatic.com/store_item_assets/steam/apps/570/library_600x900.jpg",
    "lastPlayed": null
  }
]
